[
  {
    "schemaVersion": 0,
    "eventId": "ce36863f51b6baf9d16397ffb3e9af50",
    "source": "local.demo",
    "sessionId": "fa57a52dbf08190218529730a3e99db6",
    "actorId": "2c313b760859e3481da4ab4f7db85307",
    "occurredAt": "2026-07-14T10:00:00Z",
    "kind": "turn.started"
  },
  {
    "schemaVersion": 0,
    "eventId": "b4e3d14e7519279e6a352f776d75a905",
    "source": "local.demo",
    "sessionId": "fa57a52dbf08190218529730a3e99db6",
    "actorId": "b93e0a73c0ca1df8179510bb06647ae2",
    "parentActorId": "2c313b760859e3481da4ab4f7db85307",
    "occurredAt": "2026-07-14T10:00:01Z",
    "kind": "agent.started"
  },
  {
    "schemaVersion": 0,
    "eventId": "1441ba5507f9658d9bea29b0d9567e69",
    "source": "local.demo",
    "sessionId": "fa57a52dbf08190218529730a3e99db6",
    "actorId": "89864d3e1a163911e5cd588b7399989f",
    "parentActorId": "2c313b760859e3481da4ab4f7db85307",
    "occurredAt": "2026-07-14T10:00:02Z",
    "kind": "agent.started"
  },
  {
    "schemaVersion": 0,
    "eventId": "7867155e59d4840ba0ddc4e8a2105ef5",
    "source": "local.demo",
    "sessionId": "e8de016fbd70182f6d2325e81df82550",
    "actorId": "e0bf8f19997163a0e8537dcaee330253",
    "occurredAt": "2026-07-14T10:00:03Z",
    "kind": "approval.waiting"
  },
  {
    "schemaVersion": 0,
    "eventId": "2e46e678bb4f65f93919deca4cfccb22",
    "source": "local.demo",
    "sessionId": "9e518076ab402987f2846e1ae5a0416e",
    "actorId": "6e48e21a5db1a366f13f14f5ef080935",
    "occurredAt": "2026-07-14T10:00:04Z",
    "kind": "turn.stopping",
    "outcome": "success"
  },
  {
    "schemaVersion": 0,
    "eventId": "dee9b7bd6593cfa90d48e86c6bcd59cf",
    "source": "local.demo",
    "sessionId": "18824f024f412983dccb011eb42a90eb",
    "actorId": "59794a6c1152e403aa69bcbefa94507b",
    "occurredAt": "2026-07-14T10:00:05Z",
    "kind": "turn.stopping",
    "outcome": "failure"
  },
  {
    "schemaVersion": 0,
    "eventId": "5976124a116880e33f397dc0a913686e",
    "source": "local.demo",
    "sessionId": "219885bcf6b7b9501487b5eb89a7309f",
    "actorId": "4aec8699614a502b6b0486080534f206",
    "occurredAt": "2026-07-14T09:58:20Z",
    "kind": "turn.started"
  }
]
